{
  "type": "echo-workshop-theme-preset",
  "schemaVersion": 1,
  "id": "echo.lyric-ink",
  "title": "Lyric Ink",
  "basePreset": "classic",
  "runtime": {
    "entry": "ui/index.html",
    "presentation": "lyrics-view",
    "capabilities": [
      "playback:read",
      "playback:control",
      "lyrics:read"
    ]
  },
  "light": {
    "accent": "#37677f"
  },
  "dark": {
    "accent": "#98bfd4"
  }
}
